[
  {
    "id": "ER-001",
    "category": "capacity_calculation",
    "description": "Basic capacity calculation with $100M fund, 15% cap, 5-year period",
    "input": {
      "fundSize": 100,
      "recyclingCapPercent": 15,
      "recyclingPeriod": 5
    },
    "expectedOutput": {
      "maxRecyclableCapital": 15,
      "recyclingCapPercentage": 15,
      "recyclingPeriodYears": 5,
      "annualRecyclingCapacity": 3
    },
    "tolerance": 0.01,
    "notes": "Baseline scenario with industry standard parameters. Tests fundamental capacity calculation: maxRecyclableCapital = fundSize * (recyclingCapPercent / 100), annualCapacity = maxRecyclableCapital / recyclingPeriod",
    "tags": ["baseline", "industry-standard", "capacity"]
  },
  {
    "id": "ER-002",
    "category": "capacity_calculation",
    "description": "High capacity calculation with $250M fund, 20% cap, 7-year period",
    "input": {
      "fundSize": 250,
      "recyclingCapPercent": 20,
      "recyclingPeriod": 7
    },
    "expectedOutput": {
      "maxRecyclableCapital": 50,
      "recyclingCapPercentage": 20,
      "recyclingPeriodYears": 7,
      "annualRecyclingCapacity": 7.142857
    },
    "tolerance": 0.01,
    "notes": "Larger fund with upper-range recycling cap (20% is at the high end of typical). Tests that calculations scale correctly for large fund sizes and longer recycling periods.",
    "tags": ["upper-bound", "large-fund", "capacity"]
  },
  {
    "id": "ER-003",
    "category": "capacity_calculation",
    "description": "Low capacity calculation with $50M fund, 10% cap, 3-year period",
    "input": {
      "fundSize": 50,
      "recyclingCapPercent": 10,
      "recyclingPeriod": 3
    },
    "expectedOutput": {
      "maxRecyclableCapital": 5,
      "recyclingCapPercentage": 10,
      "recyclingPeriodYears": 3,
      "annualRecyclingCapacity": 1.666667
    },
    "tolerance": 0.01,
    "notes": "Smaller fund with conservative recycling cap and shorter period. Tests lower bounds of typical recycling parameters and validates calculations for smaller fund sizes.",
    "tags": ["lower-bound", "small-fund", "conservative", "capacity"]
  },
  {
    "id": "ER-004",
    "category": "schedule_calculation",
    "description": "Single exit within period with partial recycling (75% rate)",
    "input": {
      "fundSize": 100,
      "recyclingCapPercent": 15,
      "recyclingPeriod": 5,
      "exitRecyclingRate": 75,
      "exits": [
        {
          "id": "exit-1",
          "year": 3,
          "grossProceeds": 50,
          "ownershipPercent": 20
        }
      ]
    },
    "expectedOutput": {
      "totalRecycled": 7.5,
      "totalReturnedToLPs": 2.5,
      "remainingCapacity": 7.5,
      "capReached": false,
      "recyclingByExit": [
        {
          "exitId": "exit-1",
          "exitYear": 3,
          "fundProceeds": 10,
          "recycledAmount": 7.5,
          "returnedToLPs": 2.5,
          "withinPeriod": true,
          "appliedRate": 75
        }
      ],
      "cumulativeByYear": [
        {
          "year": 3,
          "cumulativeRecycled": 7.5,
          "annualRecycled": 7.5
        }
      ]
    },
    "tolerance": 0.01,
    "notes": "Single exit scenario demonstrating partial recycling. Fund receives $10M (20% of $50M gross), recycles $7.5M (75% rate), returns $2.5M to LPs. Tests basic recycling rate application and LP distribution calculation.",
    "tags": ["single-exit", "partial-recycling", "within-period", "schedule"]
  },
  {
    "id": "ER-005",
    "category": "schedule_calculation",
    "description": "Multiple exits below cap with cumulative tracking",
    "input": {
      "fundSize": 100,
      "recyclingCapPercent": 15,
      "recyclingPeriod": 5,
      "exitRecyclingRate": 75,
      "exits": [
        {
          "id": "exit-a",
          "year": 2,
          "grossProceeds": 30,
          "ownershipPercent": 25
        },
        {
          "id": "exit-b",
          "year": 3,
          "grossProceeds": 40,
          "ownershipPercent": 20
        },
        {
          "id": "exit-c",
          "year": 4,
          "grossProceeds": 20,
          "ownershipPercent": 15
        }
      ]
    },
    "expectedOutput": {
      "totalRecycled": 13.875,
      "totalReturnedToLPs": 4.625,
      "remainingCapacity": 1.125,
      "capReached": false,
      "recyclingByExit": [
        {
          "exitId": "exit-a",
          "exitYear": 2,
          "fundProceeds": 7.5,
          "recycledAmount": 5.625,
          "returnedToLPs": 1.875,
          "withinPeriod": true,
          "appliedRate": 75
        },
        {
          "exitId": "exit-b",
          "exitYear": 3,
          "fundProceeds": 8,
          "recycledAmount": 6,
          "returnedToLPs": 2,
          "withinPeriod": true,
          "appliedRate": 75
        },
        {
          "exitId": "exit-c",
          "exitYear": 4,
          "fundProceeds": 3,
          "recycledAmount": 2.25,
          "returnedToLPs": 0.75,
          "withinPeriod": true,
          "appliedRate": 75
        }
      ],
      "cumulativeByYear": [
        {
          "year": 2,
          "cumulativeRecycled": 5.625,
          "annualRecycled": 5.625
        },
        {
          "year": 3,
          "cumulativeRecycled": 11.625,
          "annualRecycled": 6
        },
        {
          "year": 4,
          "cumulativeRecycled": 13.875,
          "annualRecycled": 2.25
        }
      ]
    },
    "tolerance": 0.01,
    "notes": "Multiple exits scenario with all exits within recycling period. Total proceeds: $18.5M, total recycled: $13.875M (75% of proceeds), total returned: $4.625M. Cap not reached ($13.875M < $15M cap). Tests chronological processing, cumulative tracking, and multi-exit coordination.",
    "tags": [
      "multi-exit",
      "within-period",
      "below-cap",
      "cumulative",
      "schedule"
    ]
  },
  {
    "id": "ER-006",
    "category": "cap_enforcement",
    "description": "Exits reaching cap exactly with 100% recycling rate",
    "input": {
      "fundSize": 100,
      "recyclingCapPercent": 15,
      "recyclingPeriod": 5,
      "exitRecyclingRate": 100,
      "exits": [
        {
          "id": "exit-a",
          "year": 2,
          "grossProceeds": 50,
          "ownershipPercent": 20
        },
        {
          "id": "exit-b",
          "year": 3,
          "grossProceeds": 25,
          "ownershipPercent": 20
        }
      ]
    },
    "expectedOutput": {
      "totalRecycled": 15,
      "capReached": true,
      "excessProceeds": 0,
      "returnedToLPs": 0,
      "remainingCapacity": 0
    },
    "tolerance": 0.01,
    "notes": "Cap enforcement scenario where exits sum exactly to recycling cap with 100% recycling rate. Exit A: $10M proceeds, Exit B: $5M proceeds, total $15M matches cap exactly. All proceeds recycled, nothing returned to LPs. Tests exact cap boundary condition and full recycling rate application.",
    "tags": [
      "cap-enforcement",
      "exact-cap",
      "full-recycling",
      "boundary-condition"
    ]
  },
  {
    "id": "ER-007",
    "category": "cap_enforcement",
    "description": "Exits exceeding cap - 3 exits totaling $25M fund proceeds with $15M cap (15% of $100M fund)",
    "input": {
      "fundSize": 100,
      "recyclingCapPercent": 15,
      "recyclingPeriod": 5,
      "exitRecyclingRate": 100,
      "exits": [
        {
          "id": "Exit-A",
          "year": 2,
          "grossProceeds": 50,
          "ownershipPercent": 20
        },
        {
          "id": "Exit-B",
          "year": 3,
          "grossProceeds": 50,
          "ownershipPercent": 20
        },
        {
          "id": "Exit-C",
          "year": 4,
          "grossProceeds": 25,
          "ownershipPercent": 20
        }
      ]
    },
    "expectedOutput": {
      "totalRecycled": 15,
      "capReached": true,
      "excessProceeds": 10,
      "returnedToLPs": 10,
      "remainingCapacity": 0
    },
    "tolerance": 0.01,
    "notes": "Cap enforcement scenario: Exit A proceeds = $10M (100% recycled), Exit B proceeds = $10M (only $5M recycled, cap reached), Exit C proceeds = $5M (100% returned to LPs). Total fund proceeds = $25M, cap = $15M, excess = $10M. Tests proper handling when cumulative exits exceed recycling cap.",
    "tags": [
      "cap-enforcement",
      "multiple-exits",
      "overflow-to-lps",
      "100-percent-rate"
    ]
  },
  {
    "id": "ER-008",
    "category": "schedule_calculation",
    "description": "Partial recycling rate (50%) applied to 2 exits totaling $20M fund proceeds",
    "input": {
      "fundSize": 100,
      "recyclingCapPercent": 15,
      "recyclingPeriod": 5,
      "exitRecyclingRate": 50,
      "exits": [
        {
          "id": "Exit-A",
          "year": 2,
          "grossProceeds": 40,
          "ownershipPercent": 25
        },
        {
          "id": "Exit-B",
          "year": 3,
          "grossProceeds": 40,
          "ownershipPercent": 25
        }
      ]
    },
    "expectedOutput": {
      "totalRecycled": 10,
      "totalReturnedToLPs": 10,
      "remainingCapacity": 5,
      "capReached": false,
      "recyclingByExit": [
        {
          "exitId": "Exit-A",
          "exitYear": 2,
          "fundProceeds": 10,
          "recycledAmount": 5,
          "returnedToLPs": 5,
          "withinPeriod": true,
          "appliedRate": 50
        },
        {
          "exitId": "Exit-B",
          "exitYear": 3,
          "fundProceeds": 10,
          "recycledAmount": 5,
          "returnedToLPs": 5,
          "withinPeriod": true,
          "appliedRate": 50
        }
      ]
    },
    "tolerance": 0.01,
    "notes": "Partial recycling rate scenario: Exit A fund proceeds = $10M → 50% = $5M recycled, $5M returned. Exit B fund proceeds = $10M → 50% = $5M recycled, $5M returned. Total recycled = $10M (50% of $20M total proceeds), remaining cap = $5M. Tests that recycling rate correctly reduces recycled amounts while staying under cap.",